plant_name;latin_name;Plant Description;Sense;Beauty;Emotion;Meaning;Compassion;reflection_question
Rowan Ash;Sorbus aucuparia;A small open structured tree native to Britain, Europe, North Africa and Asia Minor. Small pinnate leaves. White flower clusters in Spring followed by berries in late summer and gold and red leaves in autumn;Vivid colours of the leaves in early Autumn light up in red and yellow. Scarlet and yellow berries in Late Summer are harvested by birds and humans alike for their vitamin rich fruit.;The wood is hard and is used for tool handles and stakes. The Berries are rich in Vitamin C and made into Jelly. Flowers attract early pollinator bees and butterflies. Berries are nutrient rich food for birds.;MRSimply placing the palm of your hand on the woody trunk of a tree can bring calm and help manage our emotions.;In folklore Rowans are a powerful anidote to evil spirits. The wood is used over fireplaces and doorways to keep evil away, likewise the trees in a garden.;If a Rowan is found growing near a house or ba it is seen to be lucky and not to be cut down.;
Himalayan Birch;Betula utilis ‘Jaquemontii’;Tall open structured tree with white bark and small ovate leaves. Male Catkin flowers open in Spring. Golden leaves in autumn. Rapid coloniser of open ground especially woodand edges.;It is difficult for humans to hear the sounds that trees make, but we can hear the sound of moving air as it comes into contact with trees. This sound of wind has been called rustling, susurration or psithurism (sith-err-iz-um).;Elegant tree celebrated for its lightness of canopy and whiteness of the bark.;Open glades and woodland edges are decorated with these elegant trees that never seem to overwhelm but dapple the shade beneath them.;Swathes of golden colour in autumn woodlands on slopes of hills and margins of woodlands light up th landscape. White bark stands out in winter against leafless woodlands and glades.;Did you know that trees communicate, and can work together to respond to threats / opportunities? Beneath every forest there is a complex underground web of roots, fungi and bacteria which connects trees and plants to one another, known as the 'wood wide web';
Honeysuckle;Lonicera periclymenum;Twining climbing plant in woodland and hedgerows with heavily scented candelabra flowers in early summer. Berries appear in late summer.;Honeysuckle is well known for its fragrance. With over a hundred species in existence, the scent varies but is often described as having jasmine and vinalla notes. Species have been bred to appeal to the human nose;The delicate whorls of sweetly scented attract insects with long proboscis and humming birds with long beaks.;Spending time in nature, in contact with plants like the honeysuckle, brings about decreased stress levels and improved emotional well-being , increased self-esteem, and greater connection to meaning-making, purpose, and spirituality;Symbolizing the bonds of undying love due to very strong entwining stems and sweet flowers. Oberon to Titania in Shakespeare's Midsummer night's Dream - 'I know a bank where the wild Thyme blows where oxlips and nodding violet grows, quite o'er canopied with luscious Woodbine';Strongly scented flowers of climbing varieties and strong flexible stems in woodland margins and hedgerows make this a popular plant. Could you grow one in a pot or in your outdoor space?;
Cranesbill;Geranium sanguineum;Cranesbill, or hardy geraniums, are perennial border plants with saucer-shaped flowers in shades of pink, purple and blue. They are popular in cottage garden schemes and offer a long season of pollen and nectar for a number of pollinators, particularly bees;The specific Latin name sanguineum refers to the red color assumed by the leaves in Autumn;What emotions does the beauty of this flower bring?;People exhibit fewer symptoms of depression and anxiety when they have access to green space, and increased focus and relaxation when spending time in nature.;MRThis the county flower of Northumberland. Why is that? Why does it matter?;Can the subjective beauty of the Cranesbill move us to care for it, ensure its survival, and safeguard it for others to enjoy?;
Maiden Pink;Dianthus deltoides;Evergreen perennial forming a speadking mat of narrow, green leaves, and producing, in late spring and summer, a profusion of heavily fringed, small, single flowers in shades of red, pink or white;How does Dianthus perceive and interact with the natural world? How do its senses differ to ours?;The dainty petals, of varying colours, attract bees and butterfiles, but are ignored by deer.;Children spending more time in nature also had healthier body mass index (BMI) measures, and therefore, greater physical health.;"Appropriately for a project based in Sheffield, this flower gets its English name from the ""pinked"" edges to the petals.";Could you grow this flower in your back garden, yard or window-sill. If so, what would be the rewards for you?;
Bellflowers;Campanula carpatica;A clump-forming perennial to 30cm, with long-stalked, rounded leaves and solitary, violet-blue or white, open-bell-shaped flowers to 3cm in width;Humans have named campanula after bells due to the similarity in shape. What sounds can you hear? Does campanula make any sounds?;Different species have been given lovely, descriptive names including Fairy Thimbles, Star of Bethlehem or Falling Stars;Artificially incorporating natural features in your own house has benefits such as reduced blood pressure, a more stable heartbeat, a 14% increase in short-term memory, a decrease in negative emotions, and an increase in positive emotions;Campanula carpatica is native to parts of Europe including the Czech Republic, Romania, Slovakia, Ukraine, Poland and Weste Russia, and can also be found growing within the Carpathian Mountains of Central Europe;Yet I experienced sometimes that the sweetest and tender, the most innocent and encouraging society may be found in any natural object... There can be no very black melancholy to him who lives in the midst of Nature and has his senses still'. (Thoreau, 1908, p. 101);